jkn1, h, Sedan, Diesel, 6, 7, 8, images/0m0zsws4.jkf.png
jkn2, j, Coupe, Gas, 6, 7, 8, images/45it0uqj.tix.png
jkn3, i, Coupe, Diesel, 6, 7, 8, images/o1rhdmbx.xx2.png
test1, 5, Combi, Diesel, 6, 6, 6, images/uokahz0k.bx5.png
test2, j, Combi, Diesel, 7, 7, 7, images/gjmt1lpc.otr.png
jkn1, kj, Coupe, Gas, 89789, 789, 789, images/s5uwoycy.2o3.png
jkn1, eryk, Combi, Gas, 8, 9, 0, images/s4gqmjhe.phu.png
jkn1, eryk, Coupe, Gas, 7, 8, 9, images/xwg2103n.3an.png
volvo, 100, Sedan, Gas, 8, 789, 7687, images/nwagtx0r.qnu.png
volvo, 200, Sedan, Diesel, 678, 678, 768, images/o24qc34s.dqe.png
volvo, 100, Sedan, Gas, 678, 65, 876, images/1pjcpwiv.ns1.png
ijk, hjk, Coupe, LPG, 88, 8, 7, images/zru5elaq.kys.png
, , Sedan, Gas, 78, 89, 89, images/lbsof4mj.uts.png
uio, uio, Coupe, Gas, 78, 789, 789, images/d11z4tjo.yrl.png
hjk, jkh, Coupe, Gas, 789, 789, 789, images/k5npzode.qg2.png
kjlk, kjk, Coupe, Gas, 89, 789, 789, images/t3bpxknl.tdf.png
